{
  "schema_version": "benchmark_source_manifest.v0.1",
  "source_id": "src-001-ccby4",
  "title": "Typed Governance Tuples for Bounded Delegation",
  "author_or_organization": "Bowlby, R.",
  "source_type": "preprint",
  "publication_date": "2026-04-17",
  "version_or_edition": "v2",
  "effective_date": "2026-04-17",
  "retrieval_date": "2026-07-10",
  "canonical_url_or_locator": "https://arxiv.org/abs/2026.0417.0001",
  "license_or_rights_posture": "arxiv-mit",
  "public_domain_status": "not_public_domain",
  "content_hash": "sha256:abcdef0123456789",
  "local_or_object_storage_locator": null,
  "source_authority_roles": ["primary_source"],
  "known_corrections_or_retractions": [],
  "ocr_or_extraction_method": null,
  "quality_flags": ["clean"],
  "included_segments": ["abstract", "section-3", "section-4"],
  "excluded_segments_and_reason": [
    {"segment": "appendix-c", "reason": "contains unreleased implementation details"}
  ],
  "privacy_or_sensitivity": "public_safe",
  "citation_format": "Bowlby, R. (2026). Typed Governance Tuples for Bounded Delegation. arXiv:2026.0417.0001."
}
